"goal_list_1","goal_list_2","goal_list_3","goal_list_4","goal_list_5","MTurkCode"
"Pay off our Storage Locker by the beginning of April.","Take my 2 dogs in to the vet for check-ups, shots and medication by May.","Start testing for additional home jobs in transcription by the end of June","Possibly get a 2nd job this summer working at the Water Park for 5 months starting in May, if not do active survey tasks and transcription for extra income by May-June.","Pay off additional medical bills and start putting money away for a small house for purchase within 18 months to 2 years.",32956
"My goal is to become a certified civil engineer","My goal is to achieve 20 pounds weightloss","My goal is to become the senior supervisor in my place of work","My goal is to save half of my income for 3 months","My goal is to exercise thrice a week",98095
"In the next three months I would like to lose 10 pounds.","My goal is to drink at least one 16oz bottle of water a day.","My goal is to pay off our back utility bills by June.","In the next three months, I would like to reduce my debt by $1,000.","",94931
"My goal is to get accepted into at least one pharmacy school.","My goal is to get an A on my anatomy midterm.","My goal is to exercise four times a week. ","","",37543
"My goal is to buy a car within 3 months.","My goal is to pay down as much credit card debt as I can within 3 months.","","","",41510
"stop smoking","be more patient","","","",26309
"Exercise (walk) 30 minutes per day 3 or 4 days a week.","Reconnect with people I've fallen out of touch with during COVID lockdowns - calll or text one friend and one family member each week.","Put $25/week into a savings subaccount for Christmas. ","Cut back on drinking soda/carbonated drinks.","",60186
"complete studies for Series 7 financial licensing ","lose 20 pounds after long quarantine ","work on long term plan to retire early","purge junk and reorganize garage","",63105
"My goal is to increase more time in doing my online jobs so as to increase my income. ","To finish our family project of establishing a home in the village.","To find time and advance in my masters degree over the holiday and evening classes. ","To be committed to my family in time and attention. ","To eat health and to be health conscious. ",12330
"My goal is to cook meals at home at least five days a week.","My goal is to include fruit or vegetables with every lunch and dinner every day, including when eating out or getting takeout.","My goal is to go down one clothing size in two months.","My goal is to continue exercising at least four times a week.","",55353
"To stop wasting time, be more efficient, and work harder every day.","To be healthier by working out every day.","To learn Japanese at least most days a week.","","",39467
"Get promoted in my job","","","","",46873
"my goal is to lose 10 pounds","my goal is to workout for 8 hours a week","my goal is to eat less fatty foods","my goal is to get at least 8 hours of sleep a night","my goal is to drink 4 bottles of water each day",92099
"Pay off the mortgage by the end of the year","Work on project management course and pass the exam to obtain Project Management certificate by end of June","Start running 5 days a week as soon as weather permits","Start looking and applying for jobs, with a goal of changing jobs within the next six months","Start learning Chinese, and work on it three times a week, every week.",45941
"My goal is to reduce the amount of caffeine I consume every week.","My goal is to get at least 3 hours of exercise every week.","My goal is read a book once a month.","","",92765
"Pay off credit cards","learn spanish","begin exercise routine","","",32118
"To stop procrastinating and get re-inspired again, get motivated! When I plan on doing something I will do it right away and not wait to get moving. To work on this habit daily, it's mindset. I want to get my momentum going again, this is my first important goal. To flip this energy into something more positive and productive, because procrastinating is such a bad habit and just promotes laziness.","To eat spinach daily, eat more vegetables. Eat healthier and cancel out sweets and junk.","To read more and write more, keep working on my novel. Acquire more wisdom along the way. Learn (something new) everyday.","To clean my place, get it completely organized, including my desk area. Rearrange and throw out things I don't need anymore. Beautify my home. Do extreme spring cleaning. I want to do some remodeling and give it a paint job.","To exercise more, get back on track with my fitness. I fell off my schedule during this pandemic. Up until a year ago I was really great with working out and exercising every day or every other day. I was committed. Time to do that again, and get moving!",56917
"My goal is to finish editing my second book, so that I can send it to the editor.","My goal is to lose 1 pound per week by walking more.","My goal is to finish organizing our storage area in the basement.","My goal is to teach my dog three new commands.","",62812
"My goal is to work out everyday and get into better shape and better health","My goal is to finally complete my bachelors degree in Criminal Justice.","","","",82650
"To earn at least $200 monthly in mturk online work and surpass previous amount earned by at least $1","To minimize desserts to just 1 per day such as: 1 cookie, 1 chocolate bar, 1 cupcake or 1 slice of cake per day.","To exercise at least 3 to 4 times a week ","","",43268
"I will use the treadmill at the fitness center for half an hour every day and increase my average speed to at least 3.5 MPH by May","I will introduce a dumbbell regimen to my evenings for at least a half hour every other day.","I will average at least $75 per week on the Amazon Mechanical Turk platform in order to cover my car payment.","I will work on getting myself into a better daily sleep schedule, including weekends and days I don't work.","I will continue to not consume alcohol for the remainder of the year.",33322
"Walk six blocks in next three months increasing distance everyday. . I just had a triple by-pass surgery and can not walk more than 35 feet at this time.","Plant a garden and have fresh vegitables to eat in three months.","Setup and stock freshwater aquarium in living room with live plants and fish within tree months.","I intend to lose weight during the next three months. I currently weigh 291#.","",24350
"My goal is to lift weights for sixty minutes five days a week.","My goal is to track my food and macro nutrients each day of the week.","","","",46136
"My goal is to start exercising at least three times a week.","My goal is to actively meditate every other day.","My goal is to save 30 dollars every week into my savings account.","My goal is to work at being self sufficient each day and strengthen my mind through internal reflection and journal writing.","",69629
"I want to read for pleasure at leat 15 minutes 3 days a week.","I want to regain my strength after having surgery and be able to walk a mile by the end of the summer","Try to do at least one educational activity with my toddler daughter 5 days a week. ","Stop spending so much money impulsively so I can save more money.","Spend more quality time with my husband thatt doesn't involve discussing our children.",26480
"I want to lose weight and feel more fit.","I want to improve my credit score.","I want to save more money for retirement.","I want to focus more on my job and be more organized to accomplish more.","",38119
"My goal is to build out my garage attic for storage in two months.","My goal is to run a 5k in under 23 minutes in three months.","My goal is to build a new computer desk in three months.","My goal is to deliver my software project completed in two weeks.","",89090
